title,author,description,link,platforms,pg,example_download_link
Overland,Finji,A squad-based survival strategy game with procedurally generated levels set in post-apocalyptic North America.,https://finji.itch.io/overland,"Windows, Linux, macOS",1,https://itch.io/bundle/download/jfQZperdE2sgwxLLjex7TxqJKIXFxDWieWC3_JlO?page=1
Night in the Woods,Finji,"At the end of everything, hold onto anything.",https://finji.itch.io/night-in-the-woods,"Windows, Linux, macOS",1,https://itch.io/bundle/download/jfQZperdE2sgwxLLjex7TxqJKIXFxDWieWC3_JlO?page=1
Kenney Game Assets 1,Kenney,"20,000+ game assets for use in your games!",https://kenney.itch.io/kenney-game-assets-1,,1,https://itch.io/bundle/download/jfQZperdE2sgwxLLjex7TxqJKIXFxDWieWC3_JlO?page=1
Gladiabots,GFX47,AI COMBAT ARENA,https://gfx47.itch.io/gladiabots,"Windows, Linux, macOS",1,https://itch.io/bundle/download/jfQZperdE2sgwxLLjex7TxqJKIXFxDWieWC3_JlO?page=1
A Short Hike,adamgryu,a little exploration game about hiking up a mountain,https://adamgryu.itch.io/a-short-hike/download/8WpFP5cgbBtaqEkQMffD8sd5uBHQTV6Sm1OTb6G4,"Windows, Linux, macOS",1,https://itch.io/bundle/download/jfQZperdE2sgwxLLjex7TxqJKIXFxDWieWC3_JlO?page=1
Lancer Core Book: First Edition PDF,Massif Press,"The core rulebook and setting guide for Lancer, a game centered on pilots and their mechs.",https://massif-press.itch.io/corebook-pdf,,1,https://itch.io/bundle/download/jfQZperdE2sgwxLLjex7TxqJKIXFxDWieWC3_JlO?page=1
ART SQOOL,Glanderco,~*LET'S DRAW*~,https://glander.itch.io/art-sqool,"Windows, macOS",1,https://itch.io/bundle/download/jfQZperdE2sgwxLLjex7TxqJKIXFxDWieWC3_JlO?page=1
A Mortician's Tale,Laundry Bear Games,A death-positive game where you play as a mortician tasked with running a funeral home,https://laundrybear.itch.io/morticians-tale/download/Lw_67XjY4ZCSMc6arqTV_Z9xvfpngERBnNkt_fUf,"Windows, macOS",1,https://itch.io/bundle/download/jfQZperdE2sgwxLLjex7TxqJKIXFxDWieWC3_JlO?page=1
Oikospiel Book I,DK,A dog opera in five acts,https://dkoikos.itch.io/oikospiel,"Windows, macOS",1,https://itch.io/bundle/download/jfQZperdE2sgwxLLjex7TxqJKIXFxDWieWC3_JlO?page=1
EXTREME MEATPUNKS FOREVER,Heather Flowers,Gay disaster mech pilots killing fascists,https://hthr.itch.io/extreme-meatpunks-forever,"Windows, Linux, macOS",1,https://itch.io/bundle/download/jfQZperdE2sgwxLLjex7TxqJKIXFxDWieWC3_JlO?page=1
BEACON,monothetic,Sci-fi Action Roguelite. Collect DNA from enemies and mutate yourself to victory!,https://monothetic.itch.io/beacon,Windows,1,https://itch.io/bundle/download/jfQZperdE2sgwxLLjex7TxqJKIXFxDWieWC3_JlO?page=1
Airships: Conquer the Skies,Zarkonnen,Design & fight with steampunk airships,https://zarkonnen.itch.io/airships,"Windows, Linux, macOS",1,https://itch.io/bundle/download/jfQZperdE2sgwxLLjex7TxqJKIXFxDWieWC3_JlO?page=1
MidBoss,Eniko,A possession based traditional roguelike with turn-based gameplay.,https://eniko.itch.io/midboss,"Windows, Linux, macOS",1,https://itch.io/bundle/download/jfQZperdE2sgwxLLjex7TxqJKIXFxDWieWC3_JlO?page=1
Minit,Devolver Digital,Minit is a peculiar little adventure played sixty seconds at a time.,https://devolverdigital.itch.io/minit/download/ZXQqa7osAHcxIo48EK_DVV_cwl_4uGNqLbGQtB8Y,"Windows, Linux, macOS",1,https://itch.io/bundle/download/jfQZperdE2sgwxLLjex7TxqJKIXFxDWieWC3_JlO?page=1
LAZA KNITEZ!!,Glitchnap,LAZA KNITEZ!! is a fast-paced jousting deathmatch game for up to 4 players.,https://glitchnap.itch.io/lazaknitez,"Windows, macOS",1,https://itch.io/bundle/download/jfQZperdE2sgwxLLjex7TxqJKIXFxDWieWC3_JlO?page=1
No Delivery,oates,An employee training video gone wrong.,https://horror-n-oates.itch.io/no-delivery,"Windows, macOS",1,https://itch.io/bundle/download/jfQZperdE2sgwxLLjex7TxqJKIXFxDWieWC3_JlO?page=1
Changeling,Steamberry Studio,Mystery and romance ensue when our MC is unwittingly drawn into a dangerous paranormal community,https://steamberry.itch.io/changeling,"Windows, macOS",1,https://itch.io/bundle/download/jfQZperdE2sgwxLLjex7TxqJKIXFxDWieWC3_JlO?page=1
Haque,Super∴Try,/hak/ Fight cute monsters! Avoid death! Save the Game,https://supertry.itch.io/haque,"Windows, Linux, macOS",1,https://itch.io/bundle/download/jfQZperdE2sgwxLLjex7TxqJKIXFxDWieWC3_JlO?page=1
Loot Rascals,Hollow Ponds,"A TALE OF FRIENDSHIP, LOSS AND REDEMPTION... IN OUTER SPACE!",https://hollowponds.itch.io/lootrascals/download/6strsK9JzuQ2FB8mmuIHbssv3FpaTfWIKZStlvrj,Windows,1,https://itch.io/bundle/download/jfQZperdE2sgwxLLjex7TxqJKIXFxDWieWC3_JlO?page=1
Babysitter Bloodbath,Puppet Combo,"A simple night of babysitting turns into an unspeakable nightmare.. VHS era, low poly slasher. PS1 style survival horror",https://puppetcombo.itch.io/babysitter-bloodbath,Windows,1,https://itch.io/bundle/download/jfQZperdE2sgwxLLjex7TxqJKIXFxDWieWC3_JlO?page=1
DragonRuby Game Toolkit,DragonRuby,"An intuitive 2D game engine. Fast, cross-platform, tiny, hot loaded.",https://dragonruby.itch.io/dragonruby-gtk,"Windows, Linux, macOS",1,https://itch.io/bundle/download/jfQZperdE2sgwxLLjex7TxqJKIXFxDWieWC3_JlO?page=1
Troika! Numinous Edition,Melsonian Arts Council,The Other world's favourite fantasy RPG,https://melsonian-arts-council.itch.io/troika-numinous-edition,,1,https://itch.io/bundle/download/jfQZperdE2sgwxLLjex7TxqJKIXFxDWieWC3_JlO?page=1
Democratic Socialism Simulator,molleindustria,Pave the road to a post-capitalist society,https://molleindustria.itch.io/democratic-socialism-simulator,"Windows, Linux, macOS",1,https://itch.io/bundle/download/jfQZperdE2sgwxLLjex7TxqJKIXFxDWieWC3_JlO?page=1
Tonight We Riot,Means Interactive,A revolutionary crowd-based retro brawler,https://meansinteractive.itch.io/tonight-we-riot,"Windows, Linux, macOS",1,https://itch.io/bundle/download/jfQZperdE2sgwxLLjex7TxqJKIXFxDWieWC3_JlO?page=1
Catlateral Damage,Manekoware,The premier first-person destructive house cat simulator!,https://manekoware.itch.io/catlateral-damage,"Windows, Linux, macOS",1,https://itch.io/bundle/download/jfQZperdE2sgwxLLjex7TxqJKIXFxDWieWC3_JlO?page=1
Crashed Lander,Don Whitaker,"Outwit gravity, explore new worlds.",https://don-whitaker.itch.io/crashedlander,"Windows, Linux, macOS",1,https://itch.io/bundle/download/jfQZperdE2sgwxLLjex7TxqJKIXFxDWieWC3_JlO?page=1
The Space Between,chrstphfr,The Space Between is a surreal narrative experience in three acts.,https://chrstphfr.itch.io/the-space-between,Windows,1,https://itch.io/bundle/download/jfQZperdE2sgwxLLjex7TxqJKIXFxDWieWC3_JlO?page=1
Wheels of Aurelia,Santa Ragione,A narrative racing game set in the roaring Italian 70s,https://santaragione.itch.io/wheelsofaurelia,"Windows, Linux, macOS",1,https://itch.io/bundle/download/jfQZperdE2sgwxLLjex7TxqJKIXFxDWieWC3_JlO?page=1
Codemancer,Important Little Games,Programming is Magic,https://importantlittlegames.itch.io/codemancer-ch-1,"Windows, macOS, Android",1,https://itch.io/bundle/download/jfQZperdE2sgwxLLjex7TxqJKIXFxDWieWC3_JlO?page=1
Beglitched,Hexecutable,a Cyberpink Adventure,https://hexecutable.itch.io/beglitched/download/1bWytFz2LxMz9l1JQq69ntc_maJMr_z2eeogJwFz,"Windows, Linux, macOS",1,https://itch.io/bundle/download/jfQZperdE2sgwxLLjex7TxqJKIXFxDWieWC3_JlO?page=1
Wide Ocean Big Jacket,Turnfollow,"A Camping Story starring: Uncle Brad, Aunt Cloanne, Mord (and Ben)",https://turnfollow.itch.io/wide-ocean-big-jacket,"Windows, Linux, macOS",2,https://itch.io/bundle/download/jfQZperdE2sgwxLLjex7TxqJKIXFxDWieWC3_JlO?page=2
"Wakamarina Valley, New Zealand",caves rd,Atmospheric Photography Simulator set in a riverside forest area of New Zealand,https://cavesrd.itch.io/newzealand,Windows,2,https://itch.io/bundle/download/jfQZperdE2sgwxLLjex7TxqJKIXFxDWieWC3_JlO?page=2
Serre,insertdisc5,A visual novel about a girl and an alien drinking tea and falling in love!,https://insertdisc5.itch.io/serre,"Windows, macOS",2,https://itch.io/bundle/download/jfQZperdE2sgwxLLjex7TxqJKIXFxDWieWC3_JlO?page=2
Vilmonic,bludgeonsoft,Artificial life and genetics evolution simulator sandbox game.,https://bludgeonsoft.itch.io/vilmonic,"Windows, Linux, macOS",2,https://itch.io/bundle/download/jfQZperdE2sgwxLLjex7TxqJKIXFxDWieWC3_JlO?page=2
Far from Noise,George Batchelor,A conversation on the edge of a cliff.,https://georgebatch.itch.io/far-from-noise,"Windows, macOS",2,https://itch.io/bundle/download/jfQZperdE2sgwxLLjex7TxqJKIXFxDWieWC3_JlO?page=2
CanariPack 8BIT TopDown,Canari Games,"8/16BIT 16x16 Tileset, Animated Sprites, Music and SFX for your game project!",https://canarigames.itch.io/canaripack-8bit-topdown,,2,https://itch.io/bundle/download/jfQZperdE2sgwxLLjex7TxqJKIXFxDWieWC3_JlO?page=2
Tape,ΛERIF°RM,Intimate project management designed for artists and designers,https://aeriform.itch.io/tape,"Windows, Linux, macOS",2,https://itch.io/bundle/download/jfQZperdE2sgwxLLjex7TxqJKIXFxDWieWC3_JlO?page=2
Vignettes,Skeleton Business,Toyish surprise-o-rama,https://skeletonbiz.itch.io/vignettes,"Windows, macOS",2,https://itch.io/bundle/download/jfQZperdE2sgwxLLjex7TxqJKIXFxDWieWC3_JlO?page=2
Intelligent Design: An Evolutionary Sandbox,Pill Bug Interactive,God game with fully simulated genetics and evolution.,https://pillbuginteractive.itch.io/intelligent-design,"Windows, Linux, macOS",2,https://itch.io/bundle/download/jfQZperdE2sgwxLLjex7TxqJKIXFxDWieWC3_JlO?page=2
As We Know It,Jaime Scribbles Games,Post-Apocalyptic Visual Novel with Romance and Drama,https://scribbles.itch.io/as-we-know-it,"Windows, Linux, macOS",2,https://itch.io/bundle/download/jfQZperdE2sgwxLLjex7TxqJKIXFxDWieWC3_JlO?page=2
Sagebrush,Redact Games,Explore a cult compound in this narrative adventure game.,https://redactgames.itch.io/sagebrush,"Windows, macOS",2,https://itch.io/bundle/download/jfQZperdE2sgwxLLjex7TxqJKIXFxDWieWC3_JlO?page=2
Sleepaway,Jay Dragon & co.,Camp counselors protect their wards from a nightmare monster in this GMless horror RPG.,https://jdragsky.itch.io/sleepaway,,2,https://itch.io/bundle/download/jfQZperdE2sgwxLLjex7TxqJKIXFxDWieWC3_JlO?page=2
Bonbon,Aetheric Games,"A short horror story, about your childhood.",https://aethericgames.itch.io/bonbon,Windows,2,https://itch.io/bundle/download/jfQZperdE2sgwxLLjex7TxqJKIXFxDWieWC3_JlO?page=2
The Testimony of Trixie Glimmer Smith,Digital Poppy,Trixie Glimmer Smith finds a haunted book. Hijinks ensue.,https://digital-poppy.itch.io/trixie,"Windows, Linux, macOS",2,https://itch.io/bundle/download/jfQZperdE2sgwxLLjex7TxqJKIXFxDWieWC3_JlO?page=2
Super Win the Game,J. Kyle Pittman,A retro-core explosion of exploration and platforming action!!,https://piratehearts.itch.io/super-win-the-game,"Windows, Linux, macOS",2,https://itch.io/bundle/download/jfQZperdE2sgwxLLjex7TxqJKIXFxDWieWC3_JlO?page=2
Pixel Fireplace,Ted Martens,Roast marshmallows and throw fresh logs onto the fire. Type words to interact. Sit back and enjoy.,https://hammertail.itch.io/pixel-fireplace,"Windows, macOS",2,https://itch.io/bundle/download/jfQZperdE2sgwxLLjex7TxqJKIXFxDWieWC3_JlO?page=2
Death and Taxes,Placeholder Gameworks,You are the Grim Reaper on an office job. Save the world.. or condemn it to damnation?,https://placeholdergameworks.itch.io/death-and-taxes,"Windows, Linux, macOS",2,https://itch.io/bundle/download/jfQZperdE2sgwxLLjex7TxqJKIXFxDWieWC3_JlO?page=2
Social Interaction Trainer,googumproduce,Learn how to conduct yourself in social situations.,https://googumproduce.itch.io/sit,"Windows, Linux, macOS, Android",2,https://itch.io/bundle/download/jfQZperdE2sgwxLLjex7TxqJKIXFxDWieWC3_JlO?page=2
Signs of the Sojourner,Echodog Games,"An introspective deck-builder about friendship, travel, and collecting snacks.",https://echodog-games.itch.io/signs-of-the-sojourner,"Windows, macOS",2,https://itch.io/bundle/download/jfQZperdE2sgwxLLjex7TxqJKIXFxDWieWC3_JlO?page=2
Task Force Kampas,ｃａｓｉｏｐｅａ,A classic shoot em' up on steroids.,https://casiopea.itch.io/taskforcekampas,Windows,2,https://itch.io/bundle/download/jfQZperdE2sgwxLLjex7TxqJKIXFxDWieWC3_JlO?page=2
Bleed 2,BootdiskRevolution,"A relentless arcade action game with air-dodging, bullet-reflecting, and tons of bosses.",https://bootdiskrevolution.itch.io/bleed-2,"Windows, Linux, macOS",2,https://itch.io/bundle/download/jfQZperdE2sgwxLLjex7TxqJKIXFxDWieWC3_JlO?page=2
10S,owch,lift the veil,https://owch.itch.io/10s,Windows,2,https://itch.io/bundle/download/jfQZperdE2sgwxLLjex7TxqJKIXFxDWieWC3_JlO?page=2
For The Honor,Mx. Quinn,Magical Princesses making messy choices.,https://mxquinn.itch.io/for-the-honor,,2,https://itch.io/bundle/download/jfQZperdE2sgwxLLjex7TxqJKIXFxDWieWC3_JlO?page=2
Fortune-499,apthomson,,https://apthomson.itch.io/fortune-499/download/q7yNN5JDi1TQm2rd6ZieJ2LFl5rGsXOf3bPi3pc1,"Windows, macOS",2,https://itch.io/bundle/download/jfQZperdE2sgwxLLjex7TxqJKIXFxDWieWC3_JlO?page=2
Glittermitten Grove,Twinbeard,Grow plants and build treehouses in this magical land of faerie delights!,https://twinbeard.itch.io/glittermitten-grove,"Windows, Linux, macOS",2,https://itch.io/bundle/download/jfQZperdE2sgwxLLjex7TxqJKIXFxDWieWC3_JlO?page=2
Blind Men,Man-Eater Games,A boys' love visual novel about a supervillain and the spies that try to stop him.,https://maneatergames.itch.io/blind-men,"Windows, Linux, macOS",2,https://itch.io/bundle/download/jfQZperdE2sgwxLLjex7TxqJKIXFxDWieWC3_JlO?page=2
The Fall of Lazarus,No Wand Studios,A first person exploration science fiction mystery game. Fathom all the story exploring an abandoned cargo spaceship.,https://no-wand-studios.itch.io/the-fall-of-lazarus,Windows,2,https://itch.io/bundle/download/jfQZperdE2sgwxLLjex7TxqJKIXFxDWieWC3_JlO?page=2
Quadrilateral Cowboy,Blendo Games,Twentieth-century Cyberpunk,https://blendogames.itch.io/quadrilateralcowboy/download/JaVj1tzyeMEOyH0RNAhX5cITqyWxCvd614ryqzoZ,"Windows, Linux, macOS",2,https://itch.io/bundle/download/jfQZperdE2sgwxLLjex7TxqJKIXFxDWieWC3_JlO?page=2
Sewer Rave,Autumn Rain,PARTY WITH RATS,https://slitherpunk.itch.io/sewer-rave,"Windows, Linux, macOS",2,https://itch.io/bundle/download/jfQZperdE2sgwxLLjex7TxqJKIXFxDWieWC3_JlO?page=2
Multi Platformer Tileset,Shackhal,Various 2D side-scrolling environments on pixel art for your projects!,https://shackhal.itch.io/multi-platformer-tileset,,2,https://itch.io/bundle/download/jfQZperdE2sgwxLLjex7TxqJKIXFxDWieWC3_JlO?page=2
Cardinal Chains,Daniel Nora,An original puzzle game about non-decreasing sequences,https://danijmn.itch.io/cardinalchains,"Windows, Linux, macOS",3,https://itch.io/bundle/download/jfQZperdE2sgwxLLjex7TxqJKIXFxDWieWC3_JlO?page=3
OneShot,futurecat,A surreal puzzle adventure game with unique mechanics / capabilities.,https://futurecat.itch.io/oneshot,Windows,3,https://itch.io/bundle/download/jfQZperdE2sgwxLLjex7TxqJKIXFxDWieWC3_JlO?page=3
DANGEROUS DUELS,Sophie Houlden,Western Local Multiplayer Quick-Draw Deathmatch,https://sophieh.itch.io/dangerousduels,"Windows, Linux, macOS",3,https://itch.io/bundle/download/jfQZperdE2sgwxLLjex7TxqJKIXFxDWieWC3_JlO?page=3
Destiny Fails Us: A New Life,Strawberry Dagger Studio,It's time to start a new life.,https://sbds.itch.io/dfu-otome,"Windows, Linux, macOS",3,https://itch.io/bundle/download/jfQZperdE2sgwxLLjex7TxqJKIXFxDWieWC3_JlO?page=3
Brassica - A Marry Tale,Boys Laugh +,A fairy tale about political marriages and gay alternatives,https://boyslaughplus.itch.io/brassica-a-marry-tale,"Windows, Linux, macOS",3,https://itch.io/bundle/download/jfQZperdE2sgwxLLjex7TxqJKIXFxDWieWC3_JlO?page=3
ECH0,Role Over Play Dead,Peace. Kids playing in mech wreckage. A ghost. One last journey to find a final resting place.,https://roleoverplaydead.itch.io/ech0,,3,https://itch.io/bundle/download/jfQZperdE2sgwxLLjex7TxqJKIXFxDWieWC3_JlO?page=3
SAI,Studio Mutiny,Stop the machines. Save the forest.,https://studiomutiny.itch.io/sai,Windows,3,https://itch.io/bundle/download/jfQZperdE2sgwxLLjex7TxqJKIXFxDWieWC3_JlO?page=3
The Stillness of the Wind,Fellow Traveller,A quiet game of life and loss.,https://fellowtraveller.itch.io/the-stillness-of-the-wind,"Windows, macOS",3,https://itch.io/bundle/download/jfQZperdE2sgwxLLjex7TxqJKIXFxDWieWC3_JlO?page=3
Space Station Architect,AL Wyvern,Space Station Map Generator and Editor,https://wyvernindustries.itch.io/stationgen,Windows,3,https://itch.io/bundle/download/jfQZperdE2sgwxLLjex7TxqJKIXFxDWieWC3_JlO?page=3
Switch 'N' Shoot,Matt Glanville,Endless arcade action with just ONE button,https://crowbarska.itch.io/switch-n-shoot,"Windows, Linux, macOS, Android",3,https://itch.io/bundle/download/jfQZperdE2sgwxLLjex7TxqJKIXFxDWieWC3_JlO?page=3
Spooky Ghosts Dot Com,zertuk,"Ruby the ghost hunter has a tough gig this Halloween. Explore the mansion, battle spooky bosses, and rescue lost cats!",https://zertuk.itch.io/spooky-ghosts-dot-com,"Windows, Linux",3,https://itch.io/bundle/download/jfQZperdE2sgwxLLjex7TxqJKIXFxDWieWC3_JlO?page=3
The Ground Itself,Everest Pipkin,A tabletop world-building game about places over time,https://everestpipkin.itch.io/the-ground-itself,,3,https://itch.io/bundle/download/jfQZperdE2sgwxLLjex7TxqJKIXFxDWieWC3_JlO?page=3
HPS Cartography Kit,Highland Paranormal Society,Hex tiles for custom cartography!,https://natetreme.itch.io/cartographykit,,3,https://itch.io/bundle/download/jfQZperdE2sgwxLLjex7TxqJKIXFxDWieWC3_JlO?page=3
Pixel Art Medieval Fantasy Characters Pack,CleanCutGames,Pack of high-quality fantasy pixel art characters.,https://cleancutgames.itch.io/pixelart-fantasy-characters,,3,https://itch.io/bundle/download/jfQZperdE2sgwxLLjex7TxqJKIXFxDWieWC3_JlO?page=3
The World Begins With You,Fabian Denter,An atmospheric puzzle-platformer-adventure.,https://fabiandenter.itch.io/the-world-begins-with-you,"Windows, macOS",3,https://itch.io/bundle/download/jfQZperdE2sgwxLLjex7TxqJKIXFxDWieWC3_JlO?page=3
Super Hexagon,Terry Cavanagh,"A minimal action game by Terry Cavanagh, with music by Chipzel.",https://terrycavanagh.itch.io/super-hexagon,"Windows, Linux, macOS, Android",3,https://itch.io/bundle/download/jfQZperdE2sgwxLLjex7TxqJKIXFxDWieWC3_JlO?page=3
Pixel Art Infinite Runner - Pack,edermunizz,Make a Infinite Runner Game!,https://edermunizz.itch.io/infinite-runner,,3,https://itch.io/bundle/download/jfQZperdE2sgwxLLjex7TxqJKIXFxDWieWC3_JlO?page=3
Shipwreck,Brushfire Games,"An adventure game in which you must travel the land, explore dungeons, and defeat monsters to escape the island.",https://brushfiregames.itch.io/shipwreck,"Windows, Linux, macOS",3,https://itch.io/bundle/download/jfQZperdE2sgwxLLjex7TxqJKIXFxDWieWC3_JlO?page=3
Knights of the Card Table,Ponywolf,Master over 100 dungeons and 3 worlds in this dungeon crawler card game.,https://ponywolf.itch.io/kotct,"Windows, macOS",3,https://itch.io/bundle/download/jfQZperdE2sgwxLLjex7TxqJKIXFxDWieWC3_JlO?page=3
Hunter's Moon Remastered,Thalamus Digital Publishing Ltd.,The official 30th anniversary remastered edition of the classic C64 shoot 'em up.,https://thalamusdigital.itch.io/hunters-moon-remastered,Windows,3,https://itch.io/bundle/download/jfQZperdE2sgwxLLjex7TxqJKIXFxDWieWC3_JlO?page=3
BIT RAT : Singularity,[bucket drum games],A hand-pixeled story-driven cyberpunk puzzler,https://bucketdrumgames.itch.io/bitrat,"Windows, Linux, macOS",3,https://itch.io/bundle/download/jfQZperdE2sgwxLLjex7TxqJKIXFxDWieWC3_JlO?page=3
Pixel Session Vol.1,"Rémy ""Trasevol_Dog"" Devaux",Five Short Experimental Games,https://trasevol-dog.itch.io/pixel-session-vol1,"Windows, Linux, macOS",3,https://itch.io/bundle/download/jfQZperdE2sgwxLLjex7TxqJKIXFxDWieWC3_JlO?page=3
"Okay, Hero",Bullet Points,A series of essays on the Metal Gear Solid games,https://bulletpoints.itch.io/okayhero,,3,https://itch.io/bundle/download/jfQZperdE2sgwxLLjex7TxqJKIXFxDWieWC3_JlO?page=3
Gun Rounds,Blabberf,"Fast paced, turn-based shooter with a cute attitude!",https://blabberf.itch.io/gunrounds,Windows,3,https://itch.io/bundle/download/jfQZperdE2sgwxLLjex7TxqJKIXFxDWieWC3_JlO?page=3
Dreaming Sarah,Asteristic Game Studio,A surreal adventure platformer.,https://asteristic.itch.io/dreamingsarah,"Windows, Linux, macOS, Android",3,https://itch.io/bundle/download/jfQZperdE2sgwxLLjex7TxqJKIXFxDWieWC3_JlO?page=3
Headspun: Dazed Edition,SUPERSTRING,An FMV/Adventure hybrid set in the human brain,https://svperstring.itch.io/headspun-dazed-edition,Windows,3,https://itch.io/bundle/download/jfQZperdE2sgwxLLjex7TxqJKIXFxDWieWC3_JlO?page=3
nullpointer,prophet goddess,first-person cyberpunk arcade action,https://prophetgoddess.itch.io/nullpointer,"Windows, Linux, macOS",3,https://itch.io/bundle/download/jfQZperdE2sgwxLLjex7TxqJKIXFxDWieWC3_JlO?page=3
Astrologaster,Nyamyam,A comedy written in the stars,https://nyamyam.itch.io/astrologaster,"Windows, macOS",3,https://itch.io/bundle/download/jfQZperdE2sgwxLLjex7TxqJKIXFxDWieWC3_JlO?page=3
Three Lesbians in a Barrow,Digital Poppy,Tabby and her friends get trapped in a barrow. Hijinks ensue.,https://digital-poppy.itch.io/lesbians,"Windows, Linux, macOS",3,https://itch.io/bundle/download/jfQZperdE2sgwxLLjex7TxqJKIXFxDWieWC3_JlO?page=3
Joggernauts,Space Mace,Deviously cooperative runner/puzzle platformer for 1-4 players.,https://spacemace.itch.io/joggernauts,"Windows, macOS",3,https://itch.io/bundle/download/jfQZperdE2sgwxLLjex7TxqJKIXFxDWieWC3_JlO?page=3
Apple Quest Monsters DX,splendidland,A collection of 80+ monsters from an RPG that doesn't exist.,https://splendidland.itch.io/apple-quest-monsters-dx,,4,https://itch.io/bundle/download/jfQZperdE2sgwxLLjex7TxqJKIXFxDWieWC3_JlO?page=4
This World Unknown,ebi-hime,"Long fantasy otome VN about dating cute guys, plus monster girls.",https://ebihime.itch.io/this-world-unknown,"Windows, Linux, macOS",4,https://itch.io/bundle/download/jfQZperdE2sgwxLLjex7TxqJKIXFxDWieWC3_JlO?page=4
Blades in the Dark,John Harper,Daring scoundrels in a haunted city,https://johnharper.itch.io/blades-in-the-dark,,4,https://itch.io/bundle/download/jfQZperdE2sgwxLLjex7TxqJKIXFxDWieWC3_JlO?page=4
Mable & The Wood,Graffiti_Games,Mable & The Wood is a Metroidvania where you can take the form of the bosses that you kill.,https://graffiti-games.itch.io/mable-and-the-wood,"Windows, Linux, macOS",4,https://itch.io/bundle/download/jfQZperdE2sgwxLLjex7TxqJKIXFxDWieWC3_JlO?page=4
EAT GIRL,tesselode,Surreal top-down dot-eating game,https://tesselode.itch.io/eatgirl,"Windows, Linux, macOS",4,https://itch.io/bundle/download/jfQZperdE2sgwxLLjex7TxqJKIXFxDWieWC3_JlO?page=4
Rebop Blasters,dean_sick,An overpowered platform fighter with destructible terrain and a procedurally generated jazz soundtrack.,https://dean-sick.itch.io/rebop-blasters,"Windows, Linux, macOS",4,https://itch.io/bundle/download/jfQZperdE2sgwxLLjex7TxqJKIXFxDWieWC3_JlO?page=4
Black Heart,boyproblems,A Carly Rae Jepsen-themed cultist TTRPG one-shot.,https://boyproblems.itch.io/black-heart,,4,https://itch.io/bundle/download/jfQZperdE2sgwxLLjex7TxqJKIXFxDWieWC3_JlO?page=4
Hyperspace Dogfights,sleeper_games,"Jet Combat Roguelite, Occasionally With Swords",https://sleeper-games.itch.io/hyperspace-dogfights,"Windows, Linux",4,https://itch.io/bundle/download/jfQZperdE2sgwxLLjex7TxqJKIXFxDWieWC3_JlO?page=4
The Rainsdowne Players,Steve O'Gorman,A creativity-driven RPG about a rundown theatre and pleasing its unruly clientele.,https://rainsdowne.itch.io/the-rainsdowne-players,"Windows, macOS",4,https://itch.io/bundle/download/jfQZperdE2sgwxLLjex7TxqJKIXFxDWieWC3_JlO?page=4
Top-Down - Interior Tileset,Raou,A versatile interior tileset for your top-down game,https://raou.itch.io/top-down-interior-tileset,,4,https://itch.io/bundle/download/jfQZperdE2sgwxLLjex7TxqJKIXFxDWieWC3_JlO?page=4
Cosmic Rochambo,dean_sick,Ram people... in spaaaaace,https://dean-sick.itch.io/cosmic-rochambo,"Windows, Linux, macOS",4,https://itch.io/bundle/download/jfQZperdE2sgwxLLjex7TxqJKIXFxDWieWC3_JlO?page=4
CanariPack 1BIT TopDown,Canari Games,"1BIT 16x16 Tileset, Animated Sprites, Music and SFX for your game project!",https://canarigames.itch.io/canaripack-1bit-topdown,,4,https://itch.io/bundle/download/jfQZperdE2sgwxLLjex7TxqJKIXFxDWieWC3_JlO?page=4
CTHULHU DEEP GREEN,Dissonance,Conspiracy Horror inspired by the Cthulhu Mythos. 3-6 players.,https://moth-lands.itch.io/cthulhu-deep-green,,4,https://itch.io/bundle/download/jfQZperdE2sgwxLLjex7TxqJKIXFxDWieWC3_JlO?page=4
Splinter Zone,MOKKA,Escape Eternal Punishment,https://mokka.itch.io/splinter-zone,Windows,4,https://itch.io/bundle/download/jfQZperdE2sgwxLLjex7TxqJKIXFxDWieWC3_JlO?page=4
Visual Out,madameberry,Broken.  Abandoned.  Replaced.,https://madameberry.itch.io/visual-out,"Windows, Linux, macOS",4,https://itch.io/bundle/download/jfQZperdE2sgwxLLjex7TxqJKIXFxDWieWC3_JlO?page=4
Polymute,Linker,A game about changing.,https://linker.itch.io/polymute,Windows,4,https://itch.io/bundle/download/jfQZperdE2sgwxLLjex7TxqJKIXFxDWieWC3_JlO?page=4
Bleed,BootdiskRevolution,"Air-dodge, slow-time and blast baddies in this twin-skick action-platformer!",https://bootdiskrevolution.itch.io/bleed,"Windows, Linux, macOS",4,https://itch.io/bundle/download/jfQZperdE2sgwxLLjex7TxqJKIXFxDWieWC3_JlO?page=4
Village Monsters,Josh Bossie,Escape to a carefree and colorful village where the monsters are your friends.,https://josh-bossie.itch.io/village-monsters,"Windows, Linux, macOS",4,https://itch.io/bundle/download/jfQZperdE2sgwxLLjex7TxqJKIXFxDWieWC3_JlO?page=4
Verdant Skies,HowlingMoonSoftware,Ensure the success of your colony as you make friends and pursue romance with a diverse cast of characters.,https://howlingmoonsoftware.itch.io/verdant-skies,"Windows, Linux, macOS",4,https://itch.io/bundle/download/jfQZperdE2sgwxLLjex7TxqJKIXFxDWieWC3_JlO?page=4
Fossil Hunters,Reptoid Games,An action-adventure game about digging for fossils and building your own dinosaurs!,https://reptoidgames.itch.io/fossil-hunters/download/vCQ2hghvOFABr3WL0dRYxWcNGgThZM9kp6gqjihA,"Windows, macOS",4,https://itch.io/bundle/download/jfQZperdE2sgwxLLjex7TxqJKIXFxDWieWC3_JlO?page=4
